<?xml version="1.0" encoding="UTF-8"?>
<ns2:Update_Call_Sheet xmlns:ns2="http://www.yawlfoundation.org/sb/callSheet" xmlns:xsi="http://www.w3.org/2001/XMLSchema-instance" xsi:schemaLocation="http://www.yawlfoundation.org/sb/callSheet ../callSheetType.xsd ">
  <generalInfo>
    <production>production</production>
    <date>2001-01-01</date>
    <weekday>weekday</weekday>
    <shootDayNo>0</shootDayNo>
  </generalInfo>
  <callSheet>
    <emergencyInfo>
      <fireAmbulance>fireAmbulance</fireAmbulance>
      <hospital>hospital</hospital>
      <police>police</police>
    </emergencyInfo>
    <director>director</director>
    <producer>producer</producer>
    <productionManager>productionManager</productionManager>
    <firstAD>firstAD</firstAD>
    <sunrise>sunrise</sunrise>
    <sunset>sunset</sunset>
    <weather>weather</weather>
    <callTimes>
      <crewCall>
        <callTime>12:00:00</callTime>
        <callLoc>callLoc</callLoc>
      </crewCall>
      <locationCall>
        <callTime>12:00:00</callTime>
        <callLoc>callLoc</callLoc>
      </locationCall>
      <makeupHair>
        <callTime>12:00:00</callTime>
        <callLoc>callLoc</callLoc>
      </makeupHair>
      <wardrobe>
        <callTime>12:00:00</callTime>
        <callLoc>callLoc</callLoc>
      </wardrobe>
      <unit>
        <callTime>12:00:00</callTime>
        <callLoc>callLoc</callLoc>
      </unit>
      <other>
        <call>call</call>
        <callTime>12:00:00</callTime>
        <callLoc>callLoc</callLoc>
      </other>
      <breakfast>
        <from>12:00:00</from>
        <to>12:00:00</to>
        <callLoc>callLoc</callLoc>
      </breakfast>
    </callTimes>
    <wrapTimes>
      <estWrap>estWrap</estWrap>
      <other>
        <wrap>wrap</wrap>
        <wrapTime>wrapTime</wrapTime>
      </other>
    </wrapTimes>
    <location>
      <singleLocation>
        <locationName>locationName</locationName>
        <address>address</address>
        <contact>contact</contact>
        <contactNo>contactNo</contactNo>
        <UBDMapRef>UBDMapRef</UBDMapRef>
        <locationNotes>locationNotes</locationNotes>
      </singleLocation>
    </location>
    <dailySchedule>
      <startDayNotes>startDayNotes</startDayNotes>
      <sceneSchedule>
        <scene>scene</scene>
        <pageTime>
          <number>0</number>
          <numerator>0</numerator>
        </pageTime>
        <D_N>D_N</D_N>
        <IN_EX>IN_EX</IN_EX>
        <setLocation>setLocation</setLocation>
        <synopsis>synopsis</synopsis>
        <artistTimeInfo>
          <character>character</character>
          <artist>artist</artist>
          <pickup>pickup</pickup>
          <makeup>makeup</makeup>
          <wardrobe>wardrobe</wardrobe>
          <onSet>onSet</onSet>
        </artistTimeInfo>
        <estShootTimes>estShootTimes</estShootTimes>
        <mealBreak>
          <meal>meal</meal>
          <break>break</break>
        </mealBreak>
      </sceneSchedule>
      <endDayNotes>endDayNotes</endDayNotes>
      <totalScriptPages>
        <number>0</number>
        <numerator>0</numerator>
      </totalScriptPages>
    </dailySchedule>
    <dailySetRequirements>
      <singleEntry>
        <item>item</item>
        <description>
          <scene>scene</scene>
          <requirements>requirements</requirements>
        </description>
      </singleEntry>
    </dailySetRequirements>
    <unit>unit</unit>
    <additionalEquipment>additionalEquipment</additionalEquipment>
    <additionalCrew>additionalCrew</additionalCrew>
    <directions>directions</directions>
    <parking>parking</parking>
    <catering>
      <singleMeal>
        <meal>meal</meal>
        <break>break</break>
        <serveNo>serveNo</serveNo>
        <location>location</location>
      </singleMeal>
    </catering>
    <productionNotes>productionNotes</productionNotes>
    <locationCrewNotes>locationCrewNotes</locationCrewNotes>
    <lunchPickup>lunchPickup</lunchPickup>
    <exposedRushes>exposedRushes</exposedRushes>
    <rushesScreening>rushesScreening</rushesScreening>
    <crewAgreements>crewAgreements</crewAgreements>
    <advancedSchedule>
      <shootDayNo>0</shootDayNo>
      <shootDayDate>2001-01-01</shootDayDate>
      <shootDayWeekday>shootDayWeekday</shootDayWeekday>
      <adSceneSchedule>
        <scene>scene</scene>
        <pageTime>
          <number>0</number>
          <numerator>0</numerator>
        </pageTime>
        <D_N>D_N</D_N>
        <IN_EX>IN_EX</IN_EX>
        <setSynopsis>setSynopsis</setSynopsis>
        <location>location</location>
        <characters>characters</characters>
      </adSceneSchedule>
    </advancedSchedule>
    <additionalNotes>additionalNotes</additionalNotes>
  </callSheet>
  <finalSubmission>true</finalSubmission>
</ns2:Update_Call_Sheet>
